{
  "schemaVersion": 1,
  "organizationId": "",
  "workspaceId": "",
  "owner": {
    "actorAadObjectId": "",
    "issuer": "",
    "subject": "",
    "tenantId": ""
  },
  "connections": [],
  "destination": {
    "tenantId": "",
    "teamId": "",
    "channelId": "",
    "conversationId": "",
    "rootThreadId": "",
    "serviceUrl": ""
  },
  "exchange": {"profileRef": ""},
  "pollIntervalMs": 900000
}
